MCQ,Choices,Correct
What is the scientific study of life called?,a: Chemistry | b: Biology | c: Physics | d: Geology,b
Which theme in biology explains the unity and diversity of life?,a: Evolution | b: Photosynthesis | c: Mitosis | d: Genetics,a
What is the basic unit of life that all organisms are made up of?,a: Atoms | b: Molecules | c: Cells | d: Tissues,c
"Which process allows organisms to move, grow, and reproduce?",a: Photosynthesis | b: Respiration | c: Digestion | d: Fermentation,b
What is the age of life on Earth according to the text?,a: 1 million years | b: 3.7 billion years | c: 100 million years | d: 10 billion years,b
